{
  "case_status": {
    "kind": "act4_case_status",
    "path": ".github/task-runs/2026-08-08-rv64-v15z-act4-current-f72e-a3/evidence/act4/raw/status.txt",
    "sha256": "680a9f60ccc5e9139267c7c5d4fbf0888701b9beef7f8230a643a05d8d91452c",
    "size_bytes": 9974
  },
  "cases": [
    {
      "case_id": "rv64i/I/I-add-00",
      "commits": 5724,
      "cycles": 52659,
      "elf": {
        "kind": "act4_self_checking_elf",
        "path": "am-kernels/arch-test/work/npc-rv64-ooo-current/elfs/rv64i/I/I-add-00.elf",
        "sha256": "1eec5ef02c7838777e5f4da120c3596fc92aa277b7b07bd236654cac4fda657a",
        "size_bytes": 369744
      },
      "log": {
        "kind": "act4_case_log",
        "path": ".github/task-runs/2026-08-08-rv64-v15z-act4-current-f72e-a3/evidence/act4/raw/act4-log/rv64i__I__I-add-00.log",
        "sha256": "175b2808eb4fb0b745961f8d36bfe906dfd053b2a20d0c1ae2f963d41a9c0e61",
        "size_bytes": 5963
      },
      "name": "I-add-00",
      "return_code": 0,
      "rtl_assertion_failures": 0,
      "status": "PASS",
      "suite": "rv64i/I",
      "terminal_fail_markers": 0,
      "terminal_pass_markers": 1,
      "tohost_address": "0x0000000080039300"
    },
    {
      "case_id": "rv64i/I/I-addi-00",
      "commits": 4312,
      "cycles": 38383,
      "elf": {
        "kind": "act4_self_checking_elf",
        "path": "am-kernels/arch-test/work/npc-rv64-ooo-current/elfs/rv64i/I/I-addi-00.elf",
        "sha256": "319fc7553361e601384275b9e0acee7e2f73771264c84cc14441d61090750b83",
        "size_bytes": 348864
      },
      "log": {
        "kind": "act4_case_log",
        "path": ".github/task-runs/2026-08-08-rv64-v15z-act4-current-f72e-a3/evidence/act4/raw/act4-log/rv64i__I__I-addi-00.log",
        "sha256": "43aed3aa661fbe4fd5bc4da1826c9ee15812dc22828cc61c14aa305b4ec8637d",
        "size_bytes": 5962
      },
      "name": "I-addi-00",
      "return_code": 0,
      "rtl_assertion_failures": 0,
      "status": "PASS",
      "suite": "rv64i/I",
      "terminal_fail_markers": 0,
      "terminal_pass_markers": 1,
      "tohost_address": "0x0000000080038100"
    },
    {
      "case_id": "rv64i/I/I-addiw-00",
      "commits": 4312,
      "cycles": 38315,
      "elf": {
        "kind": "act4_self_checking_elf",
        "path": "am-kernels/arch-test/work/npc-rv64-ooo-current/elfs/rv64i/I/I-addiw-00.elf",
        "sha256": "6762d229056c7d9cf39365d3df51a01ef828f18bce888acc245cd3654699dddb",
        "size_bytes": 349752
      },
      "log": {
        "kind": "act4_case_log",
        "path": ".github/task-runs/2026-08-08-rv64-v15z-act4-current-f72e-a3/evidence/act4/raw/act4-log/rv64i__I__I-addiw-00.log",
        "sha256": "c3d1473470cb24bdcc382ab81667de293bf1f07a113411c38707e431c8391d73",
        "size_bytes": 5963
      },
      "name": "I-addiw-00",
      "return_code": 0,
      "rtl_assertion_failures": 0,
      "status": "PASS",
      "suite": "rv64i/I",
      "terminal_fail_markers": 0,
      "terminal_pass_markers": 1,
      "tohost_address": "0x0000000080038200"
    },
    {
      "case_id": "rv64i/I/I-addw-00",
      "commits": 5724,
      "cycles": 52642,
      "elf": {
        "kind": "act4_self_checking_elf",
        "path": "am-kernels/arch-test/work/npc-rv64-ooo-current/elfs/rv64i/I/I-addw-00.elf",
        "sha256": "b57014919d121486b1a70d1151d9bc2c4d27dd47913f10bcbe6d719daa2b6bcf",
        "size_bytes": 370768
      },
      "log": {
        "kind": "act4_case_log",
        "path": ".github/task-runs/2026-08-08-rv64-v15z-act4-current-f72e-a3/evidence/act4/raw/act4-log/rv64i__I__I-addw-00.log",
        "sha256": "3aacb0a13e2af88f43f3e14ff9cfb197e66f1f7552d7eb65a56f9012ff1dc9a9",
        "size_bytes": 5965
      },
      "name": "I-addw-00",
      "return_code": 0,
      "rtl_assertion_failures": 0,
      "status": "PASS",
      "suite": "rv64i/I",
      "terminal_fail_markers": 0,
      "terminal_pass_markers": 1,
      "tohost_address": "0x0000000080039300"
    },
    {
      "case_id": "rv64i/I/I-and-00",
      "commits": 5724,
      "cycles": 52643,
      "elf": {
        "kind": "act4_self_checking_elf",
        "path": "am-kernels/arch-test/work/npc-rv64-ooo-current/elfs/rv64i/I/I-and-00.elf",
        "sha256": "0994b4d69fdf5566d007b91941bb97925fc7522657a8e84fa6513a8cb139fe17",
        "size_bytes": 369728
      },
      "log": {
        "kind": "act4_case_log",
        "path": ".github/task-runs/2026-08-08-rv64-v15z-act4-current-f72e-a3/evidence/act4/raw/act4-log/rv64i__I__I-and-00.log",
        "sha256": "f1702864e27fbd35afc002d8b4a178e531e89d88397ffbb154a008c1a9951b08",
        "size_bytes": 5964
      },
      "name": "I-and-00",
      "return_code": 0,
      "rtl_assertion_failures": 0,
      "status": "PASS",
      "suite": "rv64i/I",
      "terminal_fail_markers": 0,
      "terminal_pass_markers": 1,
      "tohost_address": "0x0000000080039300"
    },
    {
      "case_id": "rv64i/I/I-andi-00",
      "commits": 4312,
      "cycles": 38239,
      "elf": {
        "kind": "act4_self_checking_elf",
        "path": "am-kernels/arch-test/work/npc-rv64-ooo-current/elfs/rv64i/I/I-andi-00.elf",
        "sha256": "39c4bb17a78c17139c94d9e983a6010fcc7230aed03fc6c31044125c340676ac",
        "size_bytes": 348848
      },
      "log": {
        "kind": "act4_case_log",
        "path": ".github/task-runs/2026-08-08-rv64-v15z-act4-current-f72e-a3/evidence/act4/raw/act4-log/rv64i__I__I-andi-00.log",
        "sha256": "ea8216466be0243943091ead2878ddd795a8bce0010d8927d858b4623f63039b",
        "size_bytes": 5962
      },
      "name": "I-andi-00",
      "return_code": 0,
      "rtl_assertion_failures": 0,
      "status": "PASS",
      "suite": "rv64i/I",
      "terminal_fail_markers": 0,
      "terminal_pass_markers": 1,
      "tohost_address": "0x0000000080038100"
    },
    {
      "case_id": "rv64i/I/I-auipc-00",
      "commits": 1821,
      "cycles": 13532,
      "elf": {
        "kind": "act4_self_checking_elf",
        "path": "am-kernels/arch-test/work/npc-rv64-ooo-current/elfs/rv64i/I/I-auipc-00.elf",
        "sha256": "1ee6e76a92b5eb6afada6e637aa5e6dd8950a38483dccf9feeec4af05003845a",
        "size_bytes": 198672
      },
      "log": {
        "kind": "act4_case_log",
        "path": ".github/task-runs/2026-08-08-rv64-v15z-act4-current-f72e-a3/evidence/act4/raw/act4-log/rv64i__I__I-auipc-00.log",
        "sha256": "7fe235942ff8db59afa7250b25304fab726cf48e4de26ec93de79af828edf8af",
        "size_bytes": 5954
      },
      "name": "I-auipc-00",
      "return_code": 0,
      "rtl_assertion_failures": 0,
      "status": "PASS",
      "suite": "rv64i/I",
      "terminal_fail_markers": 0,
      "terminal_pass_markers": 1,
      "tohost_address": "0x0000000080026500"
    },
    {
      "case_id": "rv64i/I/I-beq-00",
      "commits": 6549,
      "cycles": 64363,
      "elf": {
        "kind": "act4_self_checking_elf",
        "path": "am-kernels/arch-test/work/npc-rv64-ooo-current/elfs/rv64i/I/I-beq-00.elf",
        "sha256": "72f205776e4a9064ccbe68b5f8dcf347f9ee36aa88b47d13c2f370a3be7f6bf1",
        "size_bytes": 403592
      },
      "log": {
        "kind": "act4_case_log",
        "path": ".github/task-runs/2026-08-08-rv64-v15z-act4-current-f72e-a3/evidence/act4/raw/act4-log/rv64i__I__I-beq-00.log",
        "sha256": "75763cca169c7efde89e7bf7a45a175145e3e603ae72deb64f83c001f99fb823",
        "size_bytes": 5981
      },
      "name": "I-beq-00",
      "return_code": 0,
      "rtl_assertion_failures": 0,
      "status": "PASS",
      "suite": "rv64i/I",
      "terminal_fail_markers": 0,
      "terminal_pass_markers": 1,
      "tohost_address": "0x0000000080040700"
    },
    {
      "case_id": "rv64i/I/I-bge-00",
      "commits": 6628,
      "cycles": 70570,
      "elf": {
        "kind": "act4_self_checking_elf",
        "path": "am-kernels/arch-test/work/npc-rv64-ooo-current/elfs/rv64i/I/I-bge-00.elf",
        "sha256": "2e49cab1a24f2dcbc4cb30d0b833834606b9fd6ca0091482ec8c68906c9c04b6",
        "size_bytes": 403528
      },
      "log": {
        "kind": "act4_case_log",
        "path": ".github/task-runs/2026-08-08-rv64-v15z-act4-current-f72e-a3/evidence/act4/raw/act4-log/rv64i__I__I-bge-00.log",
        "sha256": "f98a1bc33cb8c761fe1607617d7ae2dc0c4d67b74883b516a98d32269062a4ca",
        "size_bytes": 5982
      },
      "name": "I-bge-00",
      "return_code": 0,
      "rtl_assertion_failures": 0,
      "status": "PASS",
      "suite": "rv64i/I",
      "terminal_fail_markers": 0,
      "terminal_pass_markers": 1,
      "tohost_address": "0x0000000080040700"
    },
    {
      "case_id": "rv64i/I/I-bgeu-00",
      "commits": 6624,
      "cycles": 70319,
      "elf": {
        "kind": "act4_self_checking_elf",
        "path": "am-kernels/arch-test/work/npc-rv64-ooo-current/elfs/rv64i/I/I-bgeu-00.elf",
        "sha256": "af0a55e6cbc92aca6636fd4facdfde1d68211f63c9e486a83ee0dd798099c8f4",
        "size_bytes": 404328
      },
      "log": {
        "kind": "act4_case_log",
        "path": ".github/task-runs/2026-08-08-rv64-v15z-act4-current-f72e-a3/evidence/act4/raw/act4-log/rv64i__I__I-bgeu-00.log",
        "sha256": "7b65d8400ce28dedab4716456b5b331c0f62558618db96dcc91bea6aedd311f6",
        "size_bytes": 5983
      },
      "name": "I-bgeu-00",
      "return_code": 0,
      "rtl_assertion_failures": 0,
      "status": "PASS",
      "suite": "rv64i/I",
      "terminal_fail_markers": 0,
      "terminal_pass_markers": 1,
      "tohost_address": "0x0000000080040700"
    },
    {
      "case_id": "rv64i/I/I-blt-00",
      "commits": 6637,
      "cycles": 70545,
      "elf": {
        "kind": "act4_self_checking_elf",
        "path": "am-kernels/arch-test/work/npc-rv64-ooo-current/elfs/rv64i/I/I-blt-00.elf",
        "sha256": "5e1f03c6fe00fdcb9d0a5c9381b6b4ce3cfcbad30c3b07593e13275736c1ccae",
        "size_bytes": 403544
      },
      "log": {
        "kind": "act4_case_log",